{
  "coverage": {
    "combinedHardNegativeEpisodeCount": 2,
    "combinedPositiveEpisodeCount": 11,
    "coverageThresholdsSatisfied": false,
    "hardNegativeThresholdsSatisfied": false,
    "mechanismCoverage": [
      {
        "combinedHardNegativeEpisodeCount": 1,
        "combinedPositiveEpisodeCount": 7,
        "hardNegativeThresholdSatisfied": false,
        "mechanism": "broad-market-repricing",
        "positiveThresholdSatisfied": true
      },
      {
        "combinedHardNegativeEpisodeCount": 1,
        "combinedPositiveEpisodeCount": 3,
        "hardNegativeThresholdSatisfied": false,
        "mechanism": "funding-liquidity",
        "positiveThresholdSatisfied": true
      },
      {
        "combinedHardNegativeEpisodeCount": 1,
        "combinedPositiveEpisodeCount": 3,
        "hardNegativeThresholdSatisfied": false,
        "mechanism": "banking-credit",
        "positiveThresholdSatisfied": true
      },
      {
        "combinedHardNegativeEpisodeCount": 1,
        "combinedPositiveEpisodeCount": 5,
        "hardNegativeThresholdSatisfied": false,
        "mechanism": "cross-border-growth",
        "positiveThresholdSatisfied": true
      }
    ],
    "positiveThresholdsSatisfied": true
  },
  "coverageFrom": "1984-05-01",
  "coverageTo": "2025-12-31",
  "derivedFrom": "us-financial-stress-tristate-v3",
  "episodes": [
    {
      "financialState": "positive",
      "firstMonth": "1984-05-01",
      "foundationEvidence": {
        "dossierId": "e14-dossier-continental-illinois-1984-banking-credit",
        "dossierSha256": "84baa84f0e6e5797bf41cd2be26558cea754b66969b6f7d5b1927d3064e13d4b"
      },
      "foundationOrigin": "accepted-e14-dossier",
      "id": "e14-dossier-continental-illinois-1984-banking-credit",
      "independentEventId": "continental-illinois-1984",
      "lastMonth": "1984-08-01",
      "mechanisms": [
        "banking-credit"
      ],
      "name": "continental-illinois-1984",
      "sourceIds": [],
      "validationRole": "foundation-v4"
    },
    {
      "financialState": "positive",
      "firstMonth": "1987-10-01",
      "foundationEvidence": {
        "dossierId": "e14-dossier-stock-market-break-1987-broad-market-repricing",
        "dossierSha256": "8b888468a441fa1aea8cef00f32e58200b73727541f532bfba94370545d2e86a"
      },
      "foundationOrigin": "accepted-e14-dossier",
      "id": "e14-dossier-stock-market-break-1987-broad-market-repricing",
      "independentEventId": "stock-market-break-1987",
      "lastMonth": "1987-10-01",
      "mechanisms": [
        "broad-market-repricing"
      ],
      "name": "stock-market-break-1987",
      "sourceIds": [],
      "validationRole": "foundation-v4"
    },
    {
      "financialState": "positive",
      "firstMonth": "1994-12-01",
      "foundationEvidence": {
        "dossierId": "e14-dossier-mexico-1994-broad-market-repricing",
        "dossierSha256": "4304989394e2638cc58058fa0a196e26b96045056ee940734e341bbaa03b703a"
      },
      "foundationOrigin": "accepted-e14-dossier",
      "id": "e14-dossier-mexico-1994-broad-market-repricing",
      "independentEventId": "mexico-bond-turbulence-1994",
      "lastMonth": "1995-03-01",
      "mechanisms": [
        "broad-market-repricing"
      ],
      "name": "mexico-bond-turbulence-1994",
      "sourceIds": [],
      "validationRole": "foundation-v4"
    },
    {
      "financialState": "positive",
      "firstMonth": "1994-12-01",
      "foundationEvidence": {
        "dossierId": "e14-dossier-mexico-1994-cross-border-growth",
        "dossierSha256": "e65b7e891703a7574850a0509fbc5de05920cbacfce08b0a2dbee77e1c7df342"
      },
      "foundationOrigin": "accepted-e14-dossier",
      "id": "e14-dossier-mexico-1994-cross-border-growth",
      "independentEventId": "mexico-bond-turbulence-1994",
      "lastMonth": "1995-06-01",
      "mechanisms": [
        "cross-border-growth"
      ],
      "name": "mexico-bond-turbulence-1994",
      "sourceIds": [],
      "validationRole": "foundation-v4"
    },
    {
      "financialState": "positive",
      "firstMonth": "1997-07-01",
      "foundationEvidence": {
        "dossierId": "e14-dossier-asian-financial-crisis-1997-cross-border-growth",
        "dossierSha256": "517d66b069d09b3131bd71bbac91870946046bc90cc01b3b89e0a7da1dd76347"
      },
      "foundationOrigin": "accepted-e14-dossier",
      "id": "e14-dossier-asian-financial-crisis-1997-cross-border-growth",
      "independentEventId": "asian-financial-crisis-1997",
      "lastMonth": "1998-01-01",
      "mechanisms": [
        "cross-border-growth"
      ],
      "name": "asian-financial-crisis-1997",
      "sourceIds": [],
      "validationRole": "foundation-v4"
    },
    {
      "financialState": "positive",
      "firstMonth": "1998-08-01",
      "foundationEvidence": {
        "dossierId": "e14-dossier-russia-ltcm-1998-broad-market-repricing",
        "dossierSha256": "ca2ce4db0ec96c833e0611dc61b7b386d23e99ecad2d704aebe8cd1abd882f04"
      },
      "foundationOrigin": "accepted-e14-dossier",
      "id": "e14-dossier-russia-ltcm-1998-broad-market-repricing",
      "independentEventId": "russia-ltcm-1998",
      "lastMonth": "1998-10-01",
      "mechanisms": [
        "broad-market-repricing"
      ],
      "name": "russia-ltcm-1998",
      "sourceIds": [],
      "validationRole": "foundation-v4"
    },
    {
      "financialState": "positive",
      "firstMonth": "1998-08-01",
      "foundationEvidence": {
        "dossierId": "e14-dossier-russia-ltcm-1998-cross-border-growth",
        "dossierSha256": "2b9d383d583ede91789827ec51777e08973cd488c97fd10f6e73e1e30d6cb4ad"
      },
      "foundationOrigin": "accepted-e14-dossier",
      "id": "e14-dossier-russia-ltcm-1998-cross-border-growth",
      "independentEventId": "russia-ltcm-1998",
      "lastMonth": "1998-10-01",
      "mechanisms": [
        "cross-border-growth"
      ],
      "name": "russia-ltcm-1998",
      "sourceIds": [],
      "validationRole": "foundation-v4"
    },
    {
      "financialState": "positive",
      "firstMonth": "1998-08-01",
      "foundationEvidence": {
        "dossierId": "e14-dossier-russia-ltcm-1998-funding-liquidity",
        "dossierSha256": "4e932ce5d05029dd873fb494df7e9930b3b2aa3db0914f5d4b36918e443e16c0"
      },
      "foundationOrigin": "accepted-e14-dossier",
      "id": "e14-dossier-russia-ltcm-1998-funding-liquidity",
      "independentEventId": "russia-ltcm-1998",
      "lastMonth": "1998-10-01",
      "mechanisms": [
        "funding-liquidity"
      ],
      "name": "russia-ltcm-1998",
      "sourceIds": [],
      "validationRole": "foundation-v4"
    },
    {
      "financialState": "positive",
      "firstMonth": "2011-09-01",
      "foundationOrigin": "inherited-v3",
      "id": "euro-sovereign-stress-2011",
      "independentEventId": "euro-sovereign-stress-2011",
      "lastMonth": "2011-12-01",
      "mechanisms": [
        "broad-market-repricing",
        "banking-credit"
      ],
      "name": "Euro-area sovereign stress spillover",
      "sourceIds": [
        "bis-euro-sovereign-2011"
      ],
      "validationRole": "development-v1"
    },
    {
      "financialState": "positive",
      "firstMonth": "2013-05-01",
      "foundationOrigin": "inherited-v3",
      "id": "taper-tantrum-2013",
      "independentEventId": "taper-tantrum-2013",
      "lastMonth": "2013-06-01",
      "mechanisms": [
        "broad-market-repricing",
        "cross-border-growth"
      ],
      "name": "Taper-announcement market shock",
      "sourceIds": [
        "bis-taper-2013"
      ],
      "validationRole": "protected-v2"
    },
    {
      "financialState": "positive",
      "firstMonth": "2015-08-01",
      "foundationOrigin": "inherited-v3",
      "id": "china-eme-stress-2015-2016",
      "independentEventId": "china-eme-stress-2015-2016",
      "lastMonth": "2016-02-01",
      "mechanisms": [
        "broad-market-repricing",
        "cross-border-growth"
      ],
      "name": "China and emerging-market growth stress",
      "sourceIds": [
        "bis-eme-2015",
        "bis-turbulence-2016"
      ],
      "validationRole": "development-v1"
    },
    {
      "financialState": "positive",
      "firstMonth": "2018-10-01",
      "foundationOrigin": "inherited-v3",
      "id": "risk-repricing-2018q4",
      "independentEventId": "risk-repricing-2018q4",
      "lastMonth": "2018-12-01",
      "mechanisms": [
        "broad-market-repricing"
      ],
      "name": "Fourth-quarter 2018 risk repricing",
      "sourceIds": [
        "fed-2018-repricing"
      ],
      "validationRole": "development-v1"
    },
    {
      "financialState": "positive",
      "firstMonth": "2019-09-01",
      "foundationOrigin": "inherited-v3",
      "id": "repo-stress-2019",
      "independentEventId": "repo-stress-2019",
      "lastMonth": "2019-10-01",
      "mechanisms": [
        "funding-liquidity"
      ],
      "name": "US repo-market stress",
      "sourceIds": [
        "fed-repo-2019"
      ],
      "validationRole": "protected-v2"
    },
    {
      "financialState": "ambiguous",
      "firstMonth": "2021-04-01",
      "foundationOrigin": "inherited-v3",
      "id": "inflation-shock-2021-2023",
      "independentEventId": "inflation-shock-2021-2023",
      "lastMonth": "2023-05-01",
      "mechanisms": [],
      "name": "Post-pandemic inflation shock",
      "sourceIds": [
        "fred-cpi",
        "fed-mpr-2022"
      ],
      "validationRole": "contrast-v3"
    },
    {
      "financialState": "ambiguous",
      "firstMonth": "2022-03-01",
      "foundationOrigin": "inherited-v3",
      "id": "fed-tightening-2022-2023",
      "independentEventId": "fed-tightening-2022-2023",
      "lastMonth": "2023-07-01",
      "mechanisms": [],
      "name": "Federal Reserve rapid tightening cycle",
      "sourceIds": [
        "fed-fomc-rates",
        "fed-mpr-2022"
      ],
      "validationRole": "contrast-v3"
    },
    {
      "financialState": "positive",